{
  "schemaVersion": 1,
  "account": "数解AI",
  "days": [
    {
      "date": "2026-07-28",
      "channels": {
        "公众号消息": 20,
        "聊天会话": 7,
        "朋友圈": 11,
        "公众号主页": 11,
        "其他": 12,
        "推荐": 92,
        "搜一搜": 5,
        "全部": 150
      }
    },
    {
      "date": "2026-07-29",
      "channels": {
        "公众号消息": 11,
        "聊天会话": 4,
        "朋友圈": 0,
        "公众号主页": 18,
        "其他": 12,
        "推荐": 133,
        "搜一搜": 3,
        "全部": 178
      }
    },
    {
      "date": "2026-07-30",
      "channels": {
        "公众号消息": 18,
        "聊天会话": 21,
        "朋友圈": 1,
        "公众号主页": 12,
        "其他": 7,
        "推荐": 176,
        "搜一搜": 2,
        "全部": 230
      }
    },
    {
      "date": "2026-07-31",
      "channels": {
        "公众号消息": 29,
        "聊天会话": 18,
        "朋友圈": 0,
        "公众号主页": 16,
        "其他": 15,
        "推荐": 72,
        "搜一搜": 5,
        "全部": 149
      }
    },
    {
      "date": "2026-08-01",
      "channels": {
        "公众号消息": 12,
        "聊天会话": 16,
        "朋友圈": 0,
        "公众号主页": 6,
        "其他": 8,
        "推荐": 27,
        "搜一搜": 5,
        "全部": 69
      }
    },
    {
      "date": "2026-08-02",
      "channels": {
        "公众号消息": 8,
        "聊天会话": 41,
        "朋友圈": 0,
        "公众号主页": 11,
        "其他": 5,
        "推荐": 47,
        "搜一搜": 4,
        "全部": 111
      }
    },
    {
      "date": "2026-08-03",
      "channels": {
        "公众号消息": 13,
        "聊天会话": 9,
        "朋友圈": 0,
        "公众号主页": 10,
        "其他": 11,
        "推荐": 119,
        "搜一搜": 4,
        "全部": 157
      }
    },
    {
      "date": "2026-08-04",
      "channels": {
        "公众号消息": 22,
        "聊天会话": 35,
        "朋友圈": 0,
        "公众号主页": 18,
        "其他": 13,
        "推荐": 144,
        "搜一搜": 6,
        "全部": 230
      }
    },
    {
      "date": "2026-08-05",
      "channels": {
        "公众号消息": 31,
        "聊天会话": 4,
        "朋友圈": 0,
        "公众号主页": 10,
        "其他": 13,
        "推荐": 93,
        "搜一搜": 8,
        "全部": 156
      }
    },
    {
      "date": "2026-08-06",
      "channels": {
        "公众号消息": 26,
        "聊天会话": 10,
        "朋友圈": 0,
        "公众号主页": 26,
        "其他": 12,
        "推荐": 226,
        "搜一搜": 5,
        "全部": 294
      }
    },
    {
      "date": "2026-08-07",
      "channels": {
        "公众号消息": 78,
        "聊天会话": 28,
        "朋友圈": 0,
        "公众号主页": 23,
        "其他": 15,
        "推荐": 3212,
        "搜一搜": 9,
        "全部": 3349
      }
    },
    {
      "date": "2026-08-08",
      "channels": {
        "公众号消息": 61,
        "聊天会话": 16,
        "朋友圈": 0,
        "公众号主页": 35,
        "其他": 29,
        "推荐": 1649,
        "搜一搜": 12,
        "全部": 1792
      }
    },
    {
      "date": "2026-08-09",
      "channels": {
        "公众号消息": 29,
        "聊天会话": 22,
        "朋友圈": 0,
        "公众号主页": 33,
        "其他": 34,
        "推荐": 1801,
        "搜一搜": 14,
        "全部": 1927
      }
    },
    {
      "date": "2026-08-10",
      "channels": {
        "公众号消息": 26,
        "聊天会话": 15,
        "朋友圈": 1,
        "公众号主页": 29,
        "其他": 25,
        "推荐": 937,
        "搜一搜": 14,
        "全部": 1037
      }
    },
    {
      "date": "2026-08-11",
      "channels": {
        "公众号消息": 31,
        "聊天会话": 27,
        "朋友圈": 0,
        "公众号主页": 40,
        "其他": 40,
        "推荐": 1485,
        "搜一搜": 17,
        "全部": 1613
      }
    },
    {
      "date": "2026-08-12",
      "channels": {
        "公众号消息": 49,
        "聊天会话": 41,
        "朋友圈": 2,
        "公众号主页": 39,
        "其他": 29,
        "推荐": 869,
        "搜一搜": 9,
        "全部": 1014
      }
    },
    {
      "date": "2026-08-13",
      "channels": {
        "公众号消息": 47,
        "聊天会话": 41,
        "朋友圈": 3,
        "公众号主页": 33,
        "其他": 35,
        "推荐": 789,
        "搜一搜": 30,
        "全部": 950
      }
    },
    {
      "date": "2026-08-14",
      "channels": {
        "公众号消息": 62,
        "聊天会话": 43,
        "朋友圈": 2,
        "公众号主页": 43,
        "其他": 34,
        "推荐": 923,
        "搜一搜": 21,
        "全部": 1094
      }
    },
    {
      "date": "2026-08-15",
      "channels": {
        "公众号消息": 42,
        "聊天会话": 58,
        "朋友圈": 33,
        "公众号主页": 38,
        "其他": 34,
        "推荐": 1013,
        "搜一搜": 4,
        "全部": 1200
      }
    },
    {
      "date": "2026-08-16",
      "channels": {
        "公众号消息": 88,
        "聊天会话": 88,
        "朋友圈": 29,
        "公众号主页": 49,
        "其他": 28,
        "推荐": 1616,
        "搜一搜": 5,
        "全部": 1867
      }
    },
    {
      "date": "2026-08-17",
      "channels": {
        "公众号消息": 111,
        "聊天会话": 144,
        "朋友圈": 4,
        "公众号主页": 66,
        "其他": 40,
        "推荐": 1450,
        "搜一搜": 12,
        "全部": 1800
      }
    },
    {
      "date": "2026-08-18",
      "channels": {
        "公众号消息": 96,
        "聊天会话": 68,
        "朋友圈": 4,
        "公众号主页": 50,
        "其他": 47,
        "推荐": 451,
        "搜一搜": 17,
        "全部": 720
      }
    },
    {
      "date": "2026-08-19",
      "channels": {
        "公众号消息": 82,
        "聊天会话": 42,
        "朋友圈": 23,
        "公众号主页": 62,
        "其他": 42,
        "推荐": 674,
        "搜一搜": 6,
        "全部": 901
      }
    },
    {
      "date": "2026-08-20",
      "channels": {
        "公众号消息": 84,
        "聊天会话": 73,
        "朋友圈": 4,
        "公众号主页": 54,
        "其他": 40,
        "推荐": 616,
        "搜一搜": 9,
        "全部": 848
      }
    },
    {
      "date": "2026-08-21",
      "channels": {
        "公众号消息": 67,
        "聊天会话": 15,
        "朋友圈": 0,
        "公众号主页": 15,
        "其他": 29,
        "推荐": 482,
        "搜一搜": 9,
        "全部": 602
      }
    },
    {
      "date": "2026-08-22",
      "channels": {
        "公众号消息": 65,
        "聊天会话": 24,
        "朋友圈": 3,
        "公众号主页": 32,
        "其他": 42,
        "推荐": 433,
        "搜一搜": 5,
        "全部": 592
      }
    },
    {
      "date": "2026-08-23",
      "channels": {
        "公众号消息": 87,
        "聊天会话": 24,
        "朋友圈": 20,
        "公众号主页": 33,
        "其他": 40,
        "推荐": 485,
        "搜一搜": 5,
        "全部": 678
      }
    },
    {
      "date": "2026-08-24",
      "channels": {
        "公众号消息": 138,
        "聊天会话": 22,
        "朋友圈": 0,
        "公众号主页": 39,
        "其他": 48,
        "推荐": 624,
        "搜一搜": 4,
        "全部": 856
      }
    },
    {
      "date": "2026-08-25",
      "channels": {
        "公众号消息": 103,
        "聊天会话": 107,
        "朋友圈": 0,
        "公众号主页": 51,
        "其他": 81,
        "推荐": 662,
        "搜一搜": 12,
        "全部": 993
      }
    },
    {
      "date": "2026-08-26",
      "channels": {
        "公众号消息": 85,
        "聊天会话": 54,
        "朋友圈": 0,
        "公众号主页": 41,
        "其他": 59,
        "推荐": 518,
        "搜一搜": 22,
        "全部": 760
      }
    },
    {
      "date": "2026-08-27",
      "channels": {
        "公众号消息": 108,
        "聊天会话": 22,
        "朋友圈": 0,
        "公众号主页": 22,
        "其他": 38,
        "推荐": 424,
        "搜一搜": 18,
        "全部": 618
      }
    },
    {
      "date": "2026-08-28",
      "channels": {
        "公众号消息": 55,
        "聊天会话": 15,
        "朋友圈": 1,
        "公众号主页": 47,
        "其他": 28,
        "推荐": 343,
        "搜一搜": 11,
        "全部": 488
      }
    },
    {
      "date": "2026-08-29",
      "channels": {
        "公众号消息": 90,
        "聊天会话": 48,
        "朋友圈": 2,
        "公众号主页": 21,
        "其他": 19,
        "推荐": 337,
        "搜一搜": 6,
        "全部": 504
      }
    },
    {
      "date": "2026-08-30",
      "channels": {
        "公众号消息": 77,
        "聊天会话": 23,
        "朋友圈": 1,
        "公众号主页": 17,
        "其他": 29,
        "推荐": 250,
        "搜一搜": 5,
        "全部": 394
      }
    },
    {
      "date": "2026-08-31",
      "channels": {
        "公众号消息": 88,
        "聊天会话": 9,
        "朋友圈": 0,
        "公众号主页": 18,
        "其他": 26,
        "推荐": 200,
        "搜一搜": 9,
        "全部": 346
      }
    },
    {
      "date": "2026-09-01",
      "channels": {
        "公众号消息": 105,
        "聊天会话": 20,
        "朋友圈": 0,
        "公众号主页": 11,
        "其他": 27,
        "推荐": 238,
        "搜一搜": 6,
        "全部": 399
      }
    },
    {
      "date": "2026-09-02",
      "channels": {
        "公众号消息": 49,
        "聊天会话": 8,
        "朋友圈": 0,
        "公众号主页": 31,
        "其他": 20,
        "推荐": 181,
        "搜一搜": 9,
        "全部": 292
      }
    },
    {
      "date": "2026-09-03",
      "channels": {
        "公众号消息": 107,
        "聊天会话": 11,
        "朋友圈": 20,
        "公众号主页": 16,
        "其他": 14,
        "推荐": 668,
        "搜一搜": 12,
        "全部": 839
      }
    },
    {
      "date": "2026-09-04",
      "channels": {
        "公众号消息": 80,
        "聊天会话": 9,
        "朋友圈": 3,
        "公众号主页": 14,
        "其他": 39,
        "推荐": 625,
        "搜一搜": 5,
        "全部": 766
      }
    },
    {
      "date": "2026-09-05",
      "channels": {
        "公众号消息": 95,
        "聊天会话": 95,
        "朋友圈": 13,
        "公众号主页": 57,
        "其他": 45,
        "推荐": 3403,
        "搜一搜": 10,
        "全部": 3686
      }
    },
    {
      "date": "2026-09-06",
      "channels": {
        "公众号消息": 84,
        "聊天会话": 49,
        "朋友圈": 21,
        "公众号主页": 16,
        "其他": 24,
        "推荐": 1489,
        "搜一搜": 8,
        "全部": 1669
      }
    },
    {
      "date": "2026-09-07",
      "channels": {
        "公众号消息": 125,
        "聊天会话": 84,
        "朋友圈": 0,
        "公众号主页": 33,
        "其他": 34,
        "推荐": 2847,
        "搜一搜": 12,
        "全部": 3112
      }
    },
    {
      "date": "2026-09-08",
      "channels": {
        "公众号消息": 193,
        "聊天会话": 62,
        "朋友圈": 1,
        "公众号主页": 26,
        "其他": 32,
        "推荐": 2562,
        "搜一搜": 5,
        "全部": 2867
      }
    },
    {
      "date": "2026-09-09",
      "channels": {
        "公众号消息": 145,
        "聊天会话": 31,
        "朋友圈": 0,
        "公众号主页": 28,
        "其他": 49,
        "推荐": 130,
        "搜一搜": 10,
        "全部": 376
      }
    },
    {
      "date": "2026-09-10",
      "channels": {
        "公众号消息": 113,
        "聊天会话": 58,
        "朋友圈": 0,